{
  "$schema": "https://json-schema.org/draft/2020-12/schema",
  "$id": "https://github.com/lsgoodlionel/star-survey/schemas/release.schema.json",
  "title": "Survey production release manifest",
  "type": "object",
  "additionalProperties": false,
  "required": ["schemaVersion", "version", "channel", "commit", "supportedHosts", "minimumSourceVersion", "database", "images", "assets"],
  "properties": {
    "schemaVersion": {"const": 1},
    "version": {"type": "string", "pattern": "^[0-9]+\\.[0-9]+\\.[0-9]+(?:-rc\\.[0-9]+)?$"},
    "channel": {"enum": ["stable", "candidate"]},
    "commit": {"type": "string", "pattern": "^[0-9a-f]{40}$"},
    "supportedHosts": {
      "type": "object",
      "additionalProperties": false,
      "required": ["ubuntu", "architectures"],
      "properties": {
        "ubuntu": {"type": "array", "minItems": 1, "items": {"enum": ["22.04", "24.04"]}},
        "architectures": {"type": "array", "minItems": 1, "items": {"enum": ["amd64", "arm64"]}}
      }
    },
    "minimumSourceVersion": {"type": "string", "pattern": "^[0-9]+\\.[0-9]+\\.[0-9]+$"},
    "database": {
      "type": "object",
      "additionalProperties": false,
      "required": ["schema", "rollback", "compatibleSourceSchemas"],
      "properties": {
        "schema": {"type": "string", "minLength": 1},
        "rollback": {"enum": ["compatible", "restore-only", "none"]},
        "compatibleSourceSchemas": {"type": "array", "items": {"type": "string"}}
      }
    },
    "images": {
      "type": "object",
      "additionalProperties": false,
      "required": ["CADDY_IMAGE", "ADMIN_IMAGE", "PLATFORM_IMAGE", "PUBLISH_GATEWAY_IMAGE", "ENGINE_IMAGE", "POSTGRES_IMAGE", "MARIADB_IMAGE"],
      "properties": {
        "CADDY_IMAGE": {"$ref": "#/$defs/image"},
        "ADMIN_IMAGE": {"$ref": "#/$defs/image"},
        "PLATFORM_IMAGE": {"$ref": "#/$defs/image"},
        "PUBLISH_GATEWAY_IMAGE": {"$ref": "#/$defs/image"},
        "ENGINE_IMAGE": {"$ref": "#/$defs/image"},
        "POSTGRES_IMAGE": {"$ref": "#/$defs/image"},
        "MARIADB_IMAGE": {"$ref": "#/$defs/image"}
      }
    },
    "assets": {
      "type": "object",
      "required": ["bundle"],
      "properties": {
        "bundle": {
          "type": "object",
          "required": ["name", "sha256"],
          "properties": {
            "name": {"type": "string", "minLength": 1},
            "sha256": {"type": "string", "pattern": "^[0-9a-f]{64}$"}
          }
        }
      }
    }
  },
  "$defs": {
    "image": {"type": "string", "pattern": "^[^@\\s]+@sha256:[0-9a-f]{64}$"}
  }
}
